{
  "schema_version": "1.0.0",
  "wave_id": "wave-mmm-descriptor-hardening-retry-2026-07-01",
  "pr_number": 1893,
  "prebrief_commit_sha": "5280579f53a21a5f9d3def9b692bc8ec7093777c",
  "builder_appointment_timestamp": "2026-07-01T17:32:10+02:00",
  "builder_appointment_commit_sha": "63b4745f2624fac33eedd600da50d6d158af3e72",
  "builder_agent": "ui-builder",
  "builder_task_ref": ".agent-admin/builder-appointments/wave-mmm-descriptor-hardening-retry-2026-07-01.md",
  "first_implementation_commit_sha": "df00d65aae708fed2a9b3a9cf8e5fc209d6f13c5",
  "qp_review_timestamp": "2026-07-01T17:35:30+02:00",
  "result": "DELEGATION_ORDER_VERIFIED"
}
